title,article,url
สภาพอากาศวันนี้ ระวังฮีทสโตรก! หลายจังหวัดร้อนทะลุ 40 องศาฯ,"วันนี้ (31 มี.ค.2567) กรมอุตุนิยมวิทยา พยากรณ์อากาศ 24 ชั่วโมงข้างหน้า ความกดอากาศต่ําเนื่องจากความร้อนปกคลุมประเทศไทยตอนบน ลักษณะเช่นนี้ทําให้ประเทศไทยมีอากาศร้อนถึงร้อนจัดกับมีฟ้าหลัวในตอนกลางวัน ขอให้ประชาชนดูแลรักษาสุขภาพเนื่องจากสภาพอากาศที่ร้อนถึงร้อนจัดในระยะนี้ไว้ด้วย 
ในขณะที่ลมใต้และลมตะวันออกเฉียงใต้พัดนําความชื้นจากอ่าวไทยและทะเลจีนใต้เข้ามาปกคลุมภาคตะวันออกเฉียงเหนือตอนล่าง และภาคตะวันออก ลักษณะเช่นนี้ทําให้บริเวณดังกล่าวมีฝนฟ้าคะนองกับมีลมกระโชกแรงบางแห่ง สําหรับลมตะวันออกและลมตะวันออกเฉียงใต้ที่พัดปกคลุมอ่าวไทย ภาคใต้ และทะเลอันดามัน ทําให้ภาคใต้มีฝนฟ้าคะนองบางแห่ง
ฝุ่นละอองในระยะนี้: ภาคเหนือ ภาคตะวันออกเฉียงเหนือ และภาคกลางตอนบน มีการสะสมของฝุ่นละออง/หมอกควันอยู่ในเกณฑ์ปานกลางถึงสูง เนื่องจากลมที่พัดปกคลุมในบริเวณดังกล่าวมีกําลังอ่อนลง



ที่มา : กรมอุตุนิยมวิทยา
 ที่มา : กรมอุตุนิยมวิทยา
อ่าน : อาการแบบไหนเสี่ยง ""ฮีทสโตรก"" ภัยหน้าร้อนที่ต้องระวัง
พยากรณ์อากาศสําหรับประเทศไทย
ภาคเหนือ
อากาศร้อนถึงร้อนจัดกับมีฟ้าหลัวในตอนกลางวัน อุณหภูมิต่ําสุด 19-24 องศาเซลเซียส อุณหภูมิสูงสุด 38-41 องศาเซลเซียส ลมตะวันตกเฉียงใต้ ความเร็ว 5-15 กม./ชม.
ภาคตะวันออกเฉียงเหนือ
อากาศร้อนกับมีฟ้าหลัวในตอนกลางวัน และมีอากาศร้อนจัดบางแห่ง โดยมีฝนฟ้าคะนอง ร้อยละ 10 ของพื้นที่ กับมีลมกระโชกแรงบางแห่ง ส่วนมากบริเวณจังหวัดอํานาจเจริญ ศรีสะเกษ และอุบลราชธานีอุณหภูมิต่ําสุด 24-26 องศาเซลเซียส อุณหภูมิสูงสุด 37-40 องศาเซลเซียส ลมใต้ ความเร็ว 10-20 กม./ชม.
ภาคกลาง
อากาศร้อนถึงร้อนจัดกับมีฟ้าหลัวในตอนกลางวัน โดยมีฝนฟ้าคะนองเล็กน้อยบางแห่งอุณหภูมิต่ําสุด 24-27 องศาเซลเซียส อุณหภูมิสูงสุด 38-41 องศาเซลเซียส ลมใต้ ความเร็ว 10-20 กม./ชม.
ภาคตะวันออก
อากาศร้อนกับมีฟ้าหลัวในตอนกลางวัน โดยมีฝนฟ้าคะนอง ร้อยละ 10 ของพื้นที่ ส่วนมากบริเวณจังหวัดจันทบุรี และตราดอุณหภูมิต่ําสุด 26-28 องศาเซลเซียสอุณหภูมิสูงสุด 34-39 องศาเซลเซียส ลมใต้ ความเร็ว 10-30 กม./ชม. ทะเลมีคลื่นต่ํากว่า 1 เมตร บริเวณที่มีฝนฟ้าคะนองคลื่นสูงมากกว่า 1 เมตร
ภาคใต้ (ฝั่งตะวันออก)
อากาศร้อนในตอนกลางวัน โดยมีฝนฟ้าคะนอง ร้อยละ 30 ของพื้นที่ ส่วนมากบริเวณจังหวัดนครศรีธรรมราช พัทลุง สงขลา ปัตตานี ยะลา และนราธิวาสอุณหภูมิต่ําสุด 24-26 องศาเซลเซียสอุณหภูมิสูงสุด 33-37 องศาเซลเซียสลมตะวันออกเฉียงใต้ ความเร็ว 15-30 กม./ชม. ทะเลมีคลื่นสูงประมาณ 1 เมตร บริเวณที่มีฝนฟ้าคะนองคลื่นสูงมากกว่า 1 เมตร
ภาคใต้ (ฝั่งตะวันตก)
อากาศร้อนในตอนกลางวัน โดยมีฝนฟ้าคะนอง ร้อยละ 30 ของพื้นที่ ส่วนมากบริเวณจังหวัดพังงา กระบี่ ตรัง และสตูลอุณหภูมิต่ําสุด 25-26 องศาเซลเซียส อุณหภูมิสูงสุด 34-37 องศาเซลเซียสลมตะวันออก ความเร็ว 15-30 กม./ชม. ทะเลมีคลื่นสูงประมาณ 1 เมตร ห่างฝั่งและบริเวณที่มีฝนฟ้าคะนองคลื่นสูงมากกว่า 1 เมตร
กรุงเทพและปริมณฑล
อากาศร้อนกับมีฟ้าหลัวในตอนกลางวัน และมีอากาศร้อนจัดบางแห่ง โดยมีฝนฟ้าคะนองเล็กน้อยบางแห่งอุณหภูมิต่ําสุด 27-28 องศาเซลเซียสอุณหภูมิสูงสุด 36-40 องศาเซลเซียส ลมใต้ ความเร็ว 10-20 กม./ชม.



ที่มา : กรมอุตุนิยมวิทยา
 ที่มา : กรมอุตุนิยมวิทยา",https://www.thaipbs.or.th/news/content/338588
"ปคม.จับกุม 15 แรงงานเมียนมาลักลอบ ""นวดแฝง"" ร้านย่านลาดพร้าว","เมื่อวันที่ 30 มี.ค.2567 ตํารวจกองบังคับการปราบปรามการค้ามนุษย์ (บก.ปคม.) นํากําลังเข้าตรวจสอบร้านนวดแผนไทยแห่งหนึ่ง ในพื้นที่ลาดพร้าว หลังได้รับรายงานว่า ร้านนวดแห่งนี้ได้ลักลอบนําแรงงานข้ามชาติที่เป็นผู้ชาย เข้ามาทํางานแฝงค้าประเวณีให้กับลูกค้า
โดยจากการตรวจสอบ พบนายสนิท อายุ 62 ปี ได้แสดงตัวเป็นเจ้าของร้าน และภายในร้านพบกลุ่มพนักงานชาย ซึ่งเป็นแรงงานข้ามชาติ สัญชาติเมียนมา จํานวน 15 คน ซึ่งจากการสอบถามกลุ่มแรงงานข้ามชาติ ให้ข้อมูลว่า จะรับงานนวดชาย ซึ่งเป็นการนวดแฝง โดยจะสับเปลี่ยนหมุนเวียนไปนวดให้กับร้านต่างๆ ตามการจองของลูกค้าที่มีติดต่อเข้ามาผ่านกลุ่มเฉพาะ ซึ่งที่ผ่านมาจะไม่อยู่ประจําร้านใดร้านหนึ่ง เพราะหลีกเลี่ยงการถูกจับกุม




เบื้องต้น ตํารวจ ได้แจ้งความดําเนินคดีกับนายสนิท ในความผิดฐานรับคนต่างด้าวเข้าทํางานโดยไม่ได้รับอนุญาต ส่วนแรงงานข้ามชาติ 15 คน ถูกดําเนินคดีในความผิดฐาน เป็นบุคคลต่างด้าวเข้ามาและอยู่ในราชอาณาจักรโดยไม่ได้รับอนุญาต ก่อนที่ทั้งหมดจะถูกนําตัวส่งพนักงานสอบสวน กองกํากับการ 1 กองบังคับการปราบปรามการค้ามนุษย์ เพื่อดําเนินคดีตามกฎหมาย
อ่านข่าวอื่น :
ไทม์ไลน์เครนถล่มตาย 7 พบเป็นโรงงานเหล็กทุนจีนแห่งที่ 2 ในระยอง
ผลเจรจาสรุป 8 ข้อ เหตุเครนถล่ม ตร.เร่งสอบปมศพหลังโรงงาน
ประกันสังคม สมทบกว่า 8 แสน เครนถล่มระยอง รมว.แรงงานย้ําเยียวยาใกล้ชิด",https://www.thaipbs.or.th/news/content/338589
"ไทยพีบีเอสระดมสมองสร้าง ""พายุหมุน"" ดันซอฟต์พาวเวอร์ไทยไประดับโลก","เมื่อวันที่ 28 มี.ค.2567 ไทยพีบีเอสจัดงาน ""Brainstorm Soft Power สร้างพายุหมุน ส่งซอฟต์พาวเวอร์ไทย ไปสู่สากล"" ได้รับเกียรติจากผู้ทรงคุณวุฒิในหลากหลายวงการ มาร่วมพูดคุยและแลกเปลี่ยนความคิดเห็นเกี่ยวกับ ทิศทาง และวิธีการสร้างซอฟต์พาวเวอร์ไทยที่มีคุณภาพ ได้แก่

ม.ร.ว.เฉลิมชาตรี ยุคล ประธานอนุกรรมการขับเคลื่อนอุตสาหกรรม ด้านภาพยนตร์
คุณชุมพล แจ้งไพร ประธานอนุกรรมการคณะกรรมการขับเคลื่อนอุตสาหกรรม ด้านอาหาร
คุณชูเกียรติ ศักดิ์วีระกุล คณะอนุกรรมการขับเคลื่อนอุตสาหกรรม ด้านละคร และซีรีส์
คุณวิเชียร ฤกษ์ไพศาล คณะกรรมการยุทธศาสตร์ซอฟต์พาวเวอร์แห่งชาติ ด้านดนตรี
ศาสตราจารย์พรรัตน์ ดํารุง คณะอนุกรรมการขับเคลื่อนอุตสาหกรรม ด้านศิลปะ
คุณลักขณา คุณาวิชยานนท์ คณะอนุกรรมการขับเคลื่อนอุตสาหกรรม ด้านศิลปะ
คุณคําหอม ศรีนอก คณะอนุกรรมการขับเคลื่อนอุตสาหกรรม ด้านหนังสือ
นพ.สุรพงษ์ สืบวงศ์ลี คณะกรรมการยุทธศาสตร์ซอฟต์เพาเวอร์แห่งชาติ และผู้ทรงคุณวุฒิจากอีกหลากหลายภาคส่วน 





รศ.ดร.วิลาสินี พิพิธกุล ผู้อํานวยการ ส.ส.ท. กล่าวว่า ในปี 2567 นี้ ไทยพีบีเอส ได้ปักหมุดยุทธศาสตร์ทางเนื้อหาขององค์กรในเรื่องของการผลักดันทุนทางวัฒนธรรม และซอฟต์พาวเวอร์ โดยจะร่วมเป็นส่วนหนึ่งในการผลักดันเรื่องนี้ให้ไปสู่ในระดับนโยบาย ไปสู่เป้าหมายในการสร้างเศรษฐกิจสร้างสรรค์ ให้เกิดขึ้นและวัดผลได้จริง รวมไปถึงการร่วมสนับสนุน ส่งเสริม ผู้ผลิตอิสระ หรือ Content Creator ของสังคมไทย ให้ได้มีโอกาสและพื้นที่ในการเผยแพร่ผลงานด้วย 
ม.ร.ว.เฉลิมชาตรี ยุคล ประธานอนุกรรมการขับเคลื่อนอุตสาหกรรม ด้านภาพยนตร์ กล่าวว่า การผลักดันอุตสาหกรรมซอฟต์พาวเวอร์ มี Pain Point ในทุกด้าน ไม่ใช่เพียงเฉพาะด้านภาพยนตร์ โดยมองปัญหา หรือจุดอ่อนในการผลักดันอุตสาหกรรมซอฟต์พาวเวอร์หลัก ๆ มีอยู่ 3 ประเด็น คือ เรื่องของการควบคุมสื่อ หรือเรื่องของกฎหมายที่มาควบคุม, เงินทุน และเรื่องของสิทธิ เสริภาพ อิสระในการสร้างสรรค์ผลงาน
ด้านชูเกียรติ ศักดิ์วีระกุล คณะอนุกรรมการขับเคลื่อนอุตสาหกรรม ด้านละคร และซีรีส์ กล่าวถึงปัญหาของวงการละคร และซีรีส์ ว่า ด้วยปัจจุบัน มีความต้องการซีรีส์เพิ่มสูงมากขึ้น ซึ่งส่งผลให้มี Content ที่จะนํามาสร้างเป็นซีรีส์ค่อนข้างที่จะขาดแคลน และเนื้อหายังวนเวียนอยู่ในเรื่องแบบเดิม ๆ มองว่าประเทศไทย มีองค์ความรู้จากท้องถิ่นที่จะสามารถนํามาเล่าได้อีกเยอะ แต่ยังคงติดปัญหาการเข้าไม่ถึงผู้ลงทุน ที่จะสามารถนําเสนอไอเดียต่าง ๆ เหล่านี้ได้ รวมไปถึงโอกาสในการนําเอาผลงานไปนําเสนอในตลาดระดับสากล ที่ยังคงต้องการการสนับสนุนจากภาครัฐด้วย
อ่านข่าวอื่น : ปคม.จับกุม 15 แรงงานเมียนมาลักลอบ ""นวดแฝง"" ร้านย่านลาดพร้าว
เชฟชุมพล แจ้งไพร ประธานอนุกรรมการคณะกรรมการขับเคลื่อนอุตสาหกรรม ด้านอาหาร กล่าวว่า โอกาสของอาหารไทยในตลาดโลกยังมีอีกเยอะ แต่ยังติดปัญหาในเรื่องของบุคลากรด้านอาหารในระดับมืออาชีพ ซึ่งจําเป็นต้องเร่งส่งเสริมให้มีการ Reskill และ Upskill ในส่วนนี้ และนอกจากในเรื่องของอาหารแล้ว เห็นว่า โอกาสของเครื่องดื่มไทย ในตลาดระดับโลก ก็ยังมีศักยภาพในการขยายตัวได้อีกสูงมาก จึงอยากให้คนที่มีศักยภาพ และเห็นโอกาสตรงนี้ ลงมือทําเลย
ส่วน นพ.สุรพงษ์ สืบวงศ์ลี คณะกรรมการยุทธศาสตร์ซอฟต์พาวเวอร์แห่งชาติ กล่าวถึงการผลักดันทุนทางวัฒนธรรม ให้ไปสู่อุตสาหกรรมซอฟต์พาวเวอร์ในเวทีสากลในครั้งนี้ ว่า จะต้องเป็นการผลักดันให้เกิดการเปลี่ยนชีวิตของคนไทยได้เลย ซึ่งการที่จะสร้างระบบนิเวศ เพื่อให้เกิดการผลักดันซอฟต์พาวเวอร์อย่างจริงจัง ต้องสร้างคน สร้างอุตสาหกรรม และสร้างตลาดโลก
นอกจาก ความเห็นจากเหล่ากูรูซอฟต์พาวเวอร์ ที่ร่วมกันแลกเปลี่ยนภายในงานแล้ว ยังได้มีการแสดงความคิดเห็น แลกเปลี่ยน ร่วมกับผู้ทรงคุณวุฒิ และผู้ที่มีส่วนเกี่ยวข้องกับงานซอฟต์พาวเวอร์ อีกหลายท่าน
โดยมีข้อสรุปถึงปัจจัยที่มีผล และเป็นทางออกของการผลักดันซอฟต์พาวเวอร์ให้ไปถึงระดับโลกได้ ได้แก่ โครงสร้างพื้นฐานที่แข็งแรงตั้งแต่ฐานราก, รัฐให้การสนับสนุนอย่างจริงจัง, การสร้างระบบนิเวศของซอฟต์พาวเวอร์, การสร้าง Mindset ความคิดสร้างสรรค์ ทันโลก มีความเป็นสากล, การสร้างโอกาสสู่การต่อยอด และแลกเปลี่ยน จนสามารถผลักดันไปสู่คุณภาพชีวิตที่ดีของคนไทย ซึ่งจะต้องเป็นการทํางานร่วมกันของทั้ง 3 ภาคส่วน ทั้งภาครัฐ ภาคเอกชน และภาคประชาชน
อ่านข่าวอื่น : แพทย์เตือนควรเปลี่ยน ""กางเกงใน"" ทุกครึ่งปี เพื่อสุขอนามัยที่ดีในร่มผ้า",https://www.thaipbs.or.th/news/content/338590
SONP ประชุมประจำปีวางแผนปรับตัวตามเทรนด์ 2024,"เมื่อวันที่ 29 มี.ค.2567 มีการประชุมคณะกรรมการบริหารสมาคมผู้ผลิตข่าวออนไลน์ (SONP) สมัยที่ 13 ครั้งที่ 3/2567 ณ ห้องประชุมWR PRIDE ไอพีจี มีเดียแบรนด์ส ประเทศไทย อาคารเอ็มไพร์ ทาวเวอร์ 2 ชั้น 28
โดยมี ดร.สร เกียรติคณารัตน์ ประธานเจ้าหน้าที่บริหาร อินิชิเอทีฟ ประเทศไทย (Initiative Thailand) และ ดร.ธราภุช จารุวัฒนะ ประธานเจ้าหน้าที่บริหารของไอพีจี มีเดียแบรนด์ส ประเทศไทย ให้การต้อนรับ และบรรยายอัปเดตเม็ดเงินโฆษณาในอุตสาหกรรมสื่อ และแนะนําการวางแผนปรับตัวเทรนด์ ปี 2024
จากนั้น นายนันทสิทธิ์ นิตย์เมธา นายกสมาคมผู้ผลิตข่าวออนไลน์ เป็นประธานการประชุมประจําเดือนมีนาคม โดยมีวาระที่สําคัญ ได้แก่ รับรองรายงานการประชุมคณะกรรมการบริหารสมาคม สมัยที่ 13 ครั้งที่ 2/2567 รายงานสถานะการเงิน เรื่องสืบเนื่อง ความคืบหน้าด้านการพัฒนาธุรกิจ ภายใต้โครงการ Premium Publisher Network- PPN
ด้านกิจกรรม ได้แก่ แนวทางการสื่อสารผ่านช่องทางต่างๆ ของสมาคมฯ โครงการเรียนรู้กับกูรูออนไลน์ (One Day Training) ปีที่ 8 ครั้งที่ 4 หัวข้อ Cyber Security โดย สมาคมอุตสาหกรรมซอฟต์แวร์ไทย ร่วมกับ SRAN
นอกจากนี้มีการรายงานความคืบหน้า กิจกรรมประจําปี 2567 อาทิ โครงการอบรมเชิงปฏิบัติการผู้ผลิตข่าวรุ่นเยาว์ รุ่นที่ 8 และโครงการประกวด ""รางวัลข่าวดิจิทัลยอดเยี่ยม ประจําปี 2567 ซึ่งมีการรับฟังความคิดเห็นของสมาชิกเพื่อนําไปพัฒนากิจกรรมให้เหมาะสมยิ่งขึ้น",https://www.thaipbs.or.th/news/content/338591
