title,article,url
"ทีมทนาย ""บิ๊กโจ๊ก"" ชี้ ตร.ออกหมายเรียกผิดปกติ ย้ำอำนาจอยู่ที่ ป.ป.ช.","วันนี้ (1 เม.ย.2567) นายณัฐวิชช์ เนติจารุโรจน์ พร้อมทีมทนายความของ พล.ต.อ.สุรเชษฐ์ หักพาล รอง ผบ.ตร. เข้ายื่นหนังสือกับผู้กํากับการ สน.เตาปูน ถึงข้อเท็จจริงที่ พล.ต.อ.สุรเชษฐ์ ต้องการยื่นเพิ่มเติม จากที่เคยยื่นไปก่อนหน้านี้
นายณัฐวิชช์ กล่าวว่า กรณีของ พล.ต.อ.สุรเชษฐ์ ที่ถูกกล่าวหาที่ สน.เตาปูน เป็นการกล่าวหาว่ามีเส้นเงินไปถึงบุคคลใกล้ชิดและผู้ใต้บังคับบัญชา ซึ่ง พล.ต.อ.สุรเชษฐ์ ยืนยันว่า ไม่มีเงินเส้นไหนไปถึงตัวเองและภรรยา ซึ่งหลักฐานที่พนักงานสอบสวนนํามาดําเนินคดีคือเรื่องเดิม โดยเป็นเรื่องของ พ.ต.ท.คริษฐ์ เกี่ยวกับบัญชีม้า ซึ่งใช้ในคดีของมินนี่ที่ สน.ทุ่งมหาเมฆ แต่พนักงานสอบสวนนํากลับมาดําเนินคดีอีกที่ สน.เตาปูน โดยระบุว่า พล.ต.อ.สุรเชษฐ์ มีส่วนพัวพันถึงเส้นเงิน
ขณที่สํานักงานคณะกรรมการป้องกันและปราบปรามการทุจริตแห่งชาติ (ป.ป.ช.) มีมติรับไต่สวนเมื่อวันที่ 4 มี.ค. ฉะนั้นอํานาจในการไต่สวนต้องอยู่ที่ ป.ป.ช. อีกทั้งผู้บัญชาการตํารวจนครบาล ได้ตั้งพนักงานสอบสวนมาดําเนินคดีที่ สน.เตาปูน โดยใช้เส้นเงินเดิมมากล่าวหาอีก ซึ่งตนเองขอย้ําว่าไม่เคยมีเส้นเงินเส้นไหนไปถึง พล.ต.อ.สุรเชษฐ์




สําหรับกรณีของ BNK Master พบธุรกรรมการเงินของ น.ส.พิมพ์วิไล มีเส้นเงินไปถึงเจ้าหน้าที่ตํารวจชั้นผู้ใหญ่ เข้าข่ายความผิดตาม มาตรา 157 ไม่อยู่ในอํานาจของพนักงานสอบสวน ทนายความของรอง ผบ.ตร.ยังตั้งคําถามว่า ตั้งแต่แถลงข่าวจนถึงปัจจุบัน พนักงานสอบสวนได้ออกหมายเรียกหรือหมายจับตํารวจเหล่านี้แล้วหรือไม่ หากยัง เหตุจึงไม่ดําเนินการและเหตุใดถึงดําเนินการแต่กับ พล.ต.อ.สุรเชษฐ์ ซึ่งรอง ผบ.ตร.ยืนยันยังไม่เคยได้รับหมายเรียก
นายณัฐวิชช์ กล่าวอีกว่า การออกหมายเรียกแต่ละครั้ง ควรเว้นระยะห่างประมาณ 15 วัน ก่อนจะออกหมายเรียกอีก 1 ครั้ง แต่กลับพบว่ามีการออกหมายเรียกแล้ว 3 ครั้ง นับรวมกันได้ 10 วัน ซึ่งส่วนตัวมองว่าเป็นเรื่องผิดปกติ ขณะที่ พล.ต.อ.สุรเชษฐ์ ทํางานและใช้ชีวิตโดยเปิดเผย ไม่มีพฤติการณ์เลี่ยงไม่รับหมาย
นอกจากนี้ ทนายความยังตั้งข้อสังเกตอีกว่า สน.เตาปูน มีการกล่าวหา พล.ต.อ.สุรเชษฐ์ แค่ฐานฟอกเงิน ซึ่งหาก พล.ต.อ.สุรเชษฐ์ มีความผิดฟอกเงิน ต้องรู้ว่าเงินที่เกี่ยวข้องเป็นเงินที่มาจากความผิด มาจากเว็บพนัน และ พล.ต.อ.สุรเชษฐ์ เป็นเจ้าหน้าที่รัฐ ก็ควรจะแจ้งความผิดตามมาตรา 157 ด้วย แต่เหตุใดพนักงานสอบสวนจึงเลือกแจ้งความผิดเฉพาะฟอกเงิน จึงมองว่าพนักงานสอบสวนต้องการเก็บคดีไว้ดําเนินการเอง
ตามกฎหมาย ป.ป.ช. หากเจ้าหน้าที่ระดับสูงกระทําผิด อํานาจจะอยู่ที่ ป.ป.ช. ส่วนพนักงานสอบสวนมีหน้าที่รวบรวมข้อเท็จจริงเบื้องต้นและส่งเรื่องไปยัง ป.ป.ช.ภายใน 30 วัน ซึ่งมีการร้องทุกข์ตั้งแต่วันที่ 3 ธ.ค.2566 จนถึงปัจจุบัน เป็นเวลา 120 วันแล้ว ยังไม่มีการส่งเรื่องไป ป.ป.ช.




ส่วนกรณีวันที่ 29 มี.ค.ที่ผ่านมา กรมสอบสวนคดีพิเศษ (ดีเอสไอ) เผยแพร่ข้อมูลคดีเว็บพนัน BNK Master เข้าเงื่อนไขของดีเอสไอ 2 ข้อ คือ มีเงินหมุนเวียน 300 ล้านบาท และมีผู้ถูกกล่าวหาเป็นตํารวจระดับสูง ดีเอสไอพิจารณาว่าเป็นข้อเท็จจริงเดียวกับคดีมินนี่ที่ ป.ป.ช.รับเรื่องไว้แล้ว จึงมีมติส่งเรื่องให้กับ ป.ป.ช.พิจารณา ซึ่งอยู่ที่ ป.ป.ช.จะรับไต่สวนตามอํานาจหรือไม่ หาก ป.ป.ช.ไม่รับคดีไว้พิจารณา ดีเอสไอจะดําเนินการเอง ซึ่งนายณัฐวิชช์ ระบุว่า ส่วนตัวไม่ว่าจะมองมิติไหน พนักงานสอบสวนไม่มีอํานาจ เพราะอํานาจอยู่ที่ ป.ป.ช.และดีเอสไอ
อย่างไรก็ตาม เมื่อเวลา 08.50 น.ที่ผ่านมา พ.ต.ท. คริษฐ์ พร้อมนายไพโรจน์ กุจิรพันธ์ นายกสมาคมพนักงานสอบสวน ได้เดินทางไป สน.เตาปูน เพื่อแจ้งความเอาผิดผู้บัญชาการตํารวจนครบาลและคณะพนักงานสืบสวนสอบสวน ในฐานละเว้นปฏิบัติหน้าที่ มาตรา 157
อ่านข่าวอื่นๆ
""ทนายตั้ม"" แจ้งความ ""บิ๊กต่อ-ภรรยา"" ข้อหาฟอกเงิน
DSI ส่งคําร้องคดีฟอกเงินเครือข่ายเว็บพนัน BNK Master ให้ ป.ป.ช.
คุม ""เจ๊อ้วน"" เข้าห้องขัง สภ.นาสัก ปมบงการฆ่า ""เสี่ยหมาส""",https://www.thaipbs.or.th/news/content/338626
รัฐบาลเพื่อใคร? ธีมซักฟอกรัฐบาลยกแรก 3-4 เม.ย.,"กรณีที่ฝ่ายค้าน​ขอเปิดอภิปรายทั่วไปแบบไม่ลงมติ ตามมาตรา 152 เพื่อซักถามข้อเท็จจริงและถามตอบรัฐมนตรีในสภา วันที่ 3-4 เม.ย.นี้ หัวข้อ​ "" รัฐบาลเพื่อใคร ประชาชนไม่ได้อะไร""
วันนี้ (1 เม.ย.2567) น.ส.ศิริกัญญา ตันสกุล พรรคก้าวไกล กล่าวว่า หัวข้อ ""รัฐบาลเพื่อใคร หัวใจไม่ใช่ประชาชน"" มีการเตรียมขุนพลพรรคก้าวไกล 34 คน ชัวร์จากข้อมูลใหม่ที่เข้ามาเพิ่มทุก ๆ วัน เพื่อความสดใหม่ในการอภิปราย เน้นสั้น กระชับ ตรงประเด็น เข้าเรื่องเร็ว ดึงดูดประชาชนที่เข้ามาฟัง
ส่วนกรณี น.ส.แพทองธาร ชินวัตร หัวหน้าพรรคเพื่อไทย และสส.พรรคหลายคน ออกมาพูดทํานองตีตนไปก่อนไข้ และเตรียมรับมือฝ่ายค้านถล่มปมนายทักษิณ ชินวัตร ขอบอกว่า ใช้คํานี้ได้เลยว่าตีตนไปก่อนไข้ ไม่ปฏิเสธว่ เรื่องนายทักษิณ เป็นหนึ่งในหัวข้ออภิปราย เพราะปัญหากระบวนการยุติธรรม ที่กําลังสร้าง 2 มาตรฐาน ไม่ทําให้ผู้คนได้รับความเป็นธรรมอย่างเสมอหน้ากัน ต้องยกตัวอย่างกรณีนายทักษิณขึ้นมาแน่นอน 



นายภูมิ​ธรรม​ เวชย​ชัย​ รองนายก​รัฐมนตรี​ และ​รมว.​พาณิชย์​
 นายภูมิ​ธรรม​ เวชย​ชัย​ รองนายก​รัฐมนตรี​ และ​รมว.​พาณิชย์​
""ภูมิธรรม"" โต้อย่าใช้วาทกรรมปั๊มตรา
ด้านนายภูมิ​ธรรม​ เวชย​ชัย​ รองนายก​รัฐมนตรี​ และ​รมว.​พาณิชย์​ กล่าวว่า​ ไม่อยากให้ใช้วาทกรรม​ การทํางานทางการเมืองและการต่อสู้ทางการเมือง​ ต้องเอาความเป็นจริงมาพูด​ในรายละเอียด​ รัฐบาลเพื่อใคร​ หัวใจไม่ใช่ประชาชน มองว่า​คนที่ตอบได้คือประชาชน ไม่ใช่พรรคการเมืองที่เป็นฝ่ายค้านมาตอบ และประชาชนจะรู้ดีที่สุดว่ารัฐบาลนี้ ทํางานเพื่อ ใครเรายึดมั่นประชาชน ขอให้ดูจากนโยบายและการกระทําดีกว่า
หมดสมัยกับการใช้วาทกรรมมา​ ปั๊มตราใคร แล้วให้คนหนึ่งพูด ควรการเมืองสมัยใหม่ร่วมกัน ใช้วาทกรรมมาจิกกัด​ มองว่าไม่สร้างสรรค์ เพราะหากสร้างสรรค์ควรใช้ข้อเสนอแนะว่าที่ไม่รับใช้ประชาชน ตรงไหน หรือหัวใจเพื่อใคร
นายภูมิธรรม พูดติดตลกว่า ขอให้ตัดหัวใจออกมาดูร่วมกันก็ได้​ ว่าหัวใจของใครเพื่อประชาชนมากกว่ากัน​ พร้อมขอว่าขอให้ประชาชนเป็นผู้ตัดสิน อย่าใช้วาทกรรม เพราะไม่ใช่การเมืองใหม่ ที่หาคําพูดมาคอยจิกกัดกันโดยไม่ดูว่าความเป็นจริงนั้นเป็นอย่างไร
อ่านข่าว ""April Fool's Day"" ผบ.ตร. เตือน ปชช. เล่นตลกต้องให้อยู่ในกรอบ



นายเศรษฐา ทวีสิน นายกรัฐมนตรี
 นายเศรษฐา ทวีสิน นายกรัฐมนตรี
วอนอย่าอภิปรายเพื่อดิสเครดิส
นายภูมิธรรม​ ยังระบุว่า​ รู้สึกเสียใจอยู่เหมือนกัน ที่เห็นว่าน้องหลายคนที่ดูท่าว่าเป็นคนรุ่นใหม่ ทํางานการเมืองสมัยใหม่ แทนที่จะมาพูดคุย ในเรื่องนโยบาย และความเป็นจริงที่เกิดขึ้น และมีข้อเสนอแนะ​ ซึ่งการอภิปรายตามมาตรา 152 เป็นการอภิปราย เพื่อเสนอแนะปัญหา ไม่ใช่การตรวจสอบที่ตั้งใจจะให้รัฐบาลมีปัญหาหรือล้มไป​ ถ้าหากจะทํา ต้องอภิปรายไม่ไว้วางใจในมาตรา 151
การอภิปรายตามมาตรา 152 เป็นเรื่องของการเสนอแนะ และความเห็นต่อรัฐบาล หรือหากมีเรื่องไหนที่ไม่สบายใจ หรือไม่แน่ใจ ก็ถามเพื่อให้รัฐบาลตอบ อย่าบิดเบือนประเด็นจากการทํางานเพื่อเป็นข้อแสดงแนะ มาเป็นการดิสเครดิตรัฐบาล การเลือกตั้ง 4 ปี​ ยังเหลืออีก 3 ปีครึ่ง​ ขอให้ไปว่ากันตรงนั้นดีกว่า
อ่านข่าว หย่อมความร้อนคลุมไทย 7 วันร้อนจัดแตะ 43 องศาฯ
ส่วนที่มีการระบุว่าจะมีการนําเรื่องในการอภิปรายไปยื่นต่อองค์กรอิสระอย่างคณะกรรมการป้องกันและปราบปรามการทุจริตแห่งชาติ (ป.ป.ช.) นายภูมิธรรม​ ระบุว่ามีสิทธิสามารถทําได้อยู่แล้ว แต่ก็ต้องมีหลักฐานให้ชัดเจน เสนอเพื่อให้เป็นประเด็นทางการเมือง​ ไม่ควรเล่นการเมืองแบบนี้ มีอะไรก็ควรจะเอามาพูดให้ชัดเจน
ไม่ต้องเก็งข้อสอบอะไร เนื่องจากเพิ่งเข้ามาทํางาน 6-7 เดือน สิ่งที่ใช้แต่งบของข้าราชการ ส่วนงบการลงทุนและการจัดการอย่างไม่มี​ งบเพิ่งจะออกปลายเดือนนี้ ต้นเดือนหน้า



น.ส.แพทองธาร ชินวัตร นายกรัฐมนตรี 
 น.ส.แพทองธาร ชินวัตร นายกรัฐมนตรี 
ไม่หวั่นปมโยง ""ทักษิณกลับไทย"" 
ส่วนมีการเตรียมความพร้อมอย่างไรหากมีการหยิบยกในประเด็นนายทักษิณ​ ชินวัตรอดีต​ นายกรัฐมนตรีขึ้นมาอภิปราย​ นายภูมิธรรมระบุว่า ไม่มีการเตรียม ต้องเอาตามความเป็นจริง​ ซึ่งนายทักษิณ​ อยู่นอกสภาฯ​ ไม่ได้เป็นอะไร​ไม่มีตําแหน่ง รัฐมนตรีอะไร​ ขออย่าเข้าใจผิด​ อย่าคิดแต่ว่ากลัวว่านายทักษิณ​ กลับมาแล้วจะมีความนิยมจากประชาชนที่ศรัทธา​ แล้วจะมีผลกระทบต่อพรรคเพื่อไทย​อย่าคิดแต่เอาชนะทางการเมืองเพราะนี่ไม่ใช่การเมืองใหม่​
อ่านข่าว
ชายเลี้ยงวัวเสียชีวิตในป่าหญ้า คาดเพราะอากาศร้อน
“นพดล ปัทมะ” จากข้อหาคนขายชาติ สู่ นักการทูตซอฟต์พาวเวอร์",https://www.thaipbs.or.th/news/content/338627
"วงการมวยเศร้า ""ณรงค์ชัย ศิษย์จอมยุทธ"" อุบัติเหตุคร่าชีวิต ","วันนี้ (1 เม.ย.2567) วงการมวยเศร้า เพจ ""มิสเตอร์ป๋อง"" ระบุว่า เมื่อวันอาทิตย์ 31 มี.ค.ที่ผ่านมา “ขุนเข่าน้ําตาไหล” ณรงค์ชัย ศิษย์จอมยุทธ นักชกอําเภอจักราช จ.นครราชสีมา เสียชีวิตอย่างสงบ หลังจากเมื่อวันที่ 22 มี.ค.ที่ผ่านมา ได้ขับขับรถจักรยานยนต์ประสบอุบัติเหตุร่างกายบอบช้ํา นอนเป็นเจ้าชายนิทราอยู่หลายวัน
จนกระทั่งวานนี้  ณรงค์ชัย  ได้เสียชีวิตอย่างสงบ ประวัติโดยย่อ ณรงค์ชัย ฝึกมวยมาตั้งแต่เด็ก จนเป็นนักชกดาวรุ่ง และอยู่ในสังกัดค่ายเกียรติเพชร และกลุ่มพลังใหม่ เสียชีวิตเมื่อวันที่ 31 มีนาคม 
อ่านข่าวอื่น ๆ
ครม.เห็นชอบเสนอ ""มวยไทย-ชุดไทย"" ขึ้นทะเบียนมรดกวัฒนธรรม",https://www.thaipbs.or.th/news/content/338628
