title,article,url
"""สุทิน"" ตรวจเกณฑ์ทหารวันแรก ย้ำ ""โปร่งใส"" ขออย่าด้อยค่าการเป็นทหาร","วันนี้ (1 เม.ย.2567) นายสุทิน คลังแสง รมว.กลาโหม ตรวจเยี่ยมหน่วยตรวจเลือกทหารเกณฑ์ที่กองพันทหารสื่อสารที่ 1 ซึ่งใช้เป็นสถานที่ตรวจเลือกทหารเกณฑ์ของเขตบางรัก โดยมีผู้เข้ารับการตรวจเลือก 85 คน ต้องการทหารเกณฑ์ในเขตนี้จํานวน 8 คน



การตรวจเลือกทหารกองเกินเข้ารับราชการทหารกองประจําการ มีกําหนดการในช่วง 1 - 12 เม.ย.2667 โดยชายไทยที่ต้องเข้ารับการตรวจเลือกปีนี้คือผู้มีอายุครบ 21 ปีบริบูรณ์ ที่เกิดปี 2546 กับ ผู้ที่เกิดระหว่างปี 2538 - 2545 หรือ อายุ 22-29 ปี
 การตรวจเลือกทหารกองเกินเข้ารับราชการทหารกองประจําการ มีกําหนดการในช่วง 1 - 12 เม.ย.2667 โดยชายไทยที่ต้องเข้ารับการตรวจเลือกปีนี้คือผู้มีอายุครบ 21 ปีบริบูรณ์ ที่เกิดปี 2546 กับ ผู้ที่เกิดระหว่างปี 2538 - 2545 หรือ อายุ 22-29 ปี
นายสุทินกล่าวว่า ทหารยังมีความจําเป็นในการทําหน้าที่รักษาความมั่นคง พร้อมยืนยันว่า การตรวจเลือกมีความโปร่งใสเป็นธรรม และระบบการฝึกทหารมีทั้งเบา-หนัก แต่ที่เป็นข่าวช่วงที่ผ่านมาเนื่องจากมีผู้จงใจให้เป็นข่าวโดยขอยืนยันว่า กองทัพไม่มีการลงโทษนอกระบบ



การตรวจเลือกทหารกองเกินเข้ารับราชการทหารกองประจําการ มีกําหนดการในช่วง 1 - 12 เม.ย.2667 โดยชายไทยที่ต้องเข้ารับการตรวจเลือกปีนี้คือผู้มีอายุครบ 21 ปีบริบูรณ์ ที่เกิดปี 2546 กับ ผู้ที่เกิดระหว่างปี 2538 - 2545 หรือ อายุ 22-29 ปี
 การตรวจเลือกทหารกองเกินเข้ารับราชการทหารกองประจําการ มีกําหนดการในช่วง 1 - 12 เม.ย.2667 โดยชายไทยที่ต้องเข้ารับการตรวจเลือกปีนี้คือผู้มีอายุครบ 21 ปีบริบูรณ์ ที่เกิดปี 2546 กับ ผู้ที่เกิดระหว่างปี 2538 - 2545 หรือ อายุ 22-29 ปี
อ่านข่าว : เกณฑ์ทหาร 2567 เช็กวัน รายละเอียด ขั้นตอนการตรวจเลือกทหาร
วันนี้ทุกหน่วยทั่วประเทศ มีการเกณฑ์ทหารเป็นวันแรก จึงถือโอกาสมาดูความเรียบร้อย พร้อมชี้ให้เห็นถึงประโยชน์ที่ชายไทยจะได้รับหากสมัครเข้าเป็นทหาร เพราะขณะนี้มีอีกฝ่ายที่พยายามด้อยคุณค่าของการเป็นทหาร ทั้งนี้ขอฝากไปยังกระบวนการที่จงใจสร้างความสับสนให้กับผู้ที่ต้องการสมัครเป็นทหาร ให้เลิกการกระทํา หรือให้เบาลง เพราะเป็นความคิดที่ไม่เป็นคุณต่อประเทศ



การตรวจเลือกทหารกองเกินเข้ารับราชการทหารกองประจําการ มีกําหนดการในช่วง 1 - 12 เม.ย.2667 โดยชายไทยที่ต้องเข้ารับการตรวจเลือกปีนี้คือผู้มีอายุครบ 21 ปีบริบูรณ์ ที่เกิดปี 2546 กับ ผู้ที่เกิดระหว่างปี 2538 - 2545 หรือ อายุ 22-29 ปี
 การตรวจเลือกทหารกองเกินเข้ารับราชการทหารกองประจําการ มีกําหนดการในช่วง 1 - 12 เม.ย.2667 โดยชายไทยที่ต้องเข้ารับการตรวจเลือกปีนี้คือผู้มีอายุครบ 21 ปีบริบูรณ์ ที่เกิดปี 2546 กับ ผู้ที่เกิดระหว่างปี 2538 - 2545 หรือ อายุ 22-29 ปี
สําหรับการตรวจเลือกทหารกองเกินเข้ารับราชการทหารกองประจําการ มีกําหนดการในช่วง 1 - 12 เม.ย.2667 โดยชายไทยที่ต้องเข้ารับการตรวจเลือกปีนี้คือผู้มีอายุครบ 21 ปีบริบูรณ์ ที่เกิดปี 2546 กับ ผู้ที่เกิดระหว่างปี 2538 - 2545 หรือ อายุ 22-29 ปี ที่ยังไม่เคยเข้ารับการตรวจเลือก โดยผู้เข้ารับการตรวจเลือกทุกคน จะได้รับใบรับรองผลการตรวจเลือก หรือ สด.43 จากประธานกรรมการตรวจเลือกเท่านั้น
อ่านข่าว : ""ก้าวไกล"" จี้ปฏิรูปกองทัพ หลังพบกรณีหักหัวคิวสร้างบ้านทหาร",https://www.thaipbs.or.th/news/content/338619
"""ทนายตั้ม"" แจ้งความ ""บิ๊กต่อ-ภรรยา"" ข้อหาฟอกเงิน","วันนี้ (1 เม.ย.2567) เวลา 10.00 น. นายษิทรา เบี้ยบังเกิด หรือ ทนายตั้ม เตรียมนําหลักฐานเส้นเงินทั้งหมด เพื่อแจ้งความ กับ พล.ต.อ.ต่อศักดิ์ สุขวิมล ผบ.ตร. และภรรยา และบัญชีม้า 2 บัญชี  ในข้อหาร่วมกันฟอกเงิน
โดยมีการนําหลักฐานเส้นทางการเงิน ชุดเดียวกับที่มอบให้ กองบังคับการป้องกันปราบปรามการทุจริตและประพฤติมิชอบ (บก.ปปป.) จํานวน 157 แผ่น มามอบให้กับพนักงานสอบสวน สน.เตาปูน
หลังจากเข้าแจ้งความแล้วจะเดินทางไปศาล เพื่อขอคัดคําฟ้องที่นายอัจฉริยะ เรืองรัตนพงศ์ ประธานชมรมช่วยเหลือเหยื่ออาชญากรรม ยื่นฟ้องและถอนฟ้องไปก่อนหน้านี้ ว่ามีข้อมูลใดที่เป็นเท็จหรือไม่ ทั้งนี้ยังไม่แจ้งดําเนินคดีตามมาตรา 157




ยืนยันการเดินทางมาแจ้งความ ในวันเดียวกัน กับที่ทนายความของ พล.ต.อ.สุรเชษฐ์ พักพาล รอง ผบ.ตร. เดินทางมาร้องขอความเป็นธรรม กรณีชุดพนักงานสอบสวน สน.เตาปูน เกี่ยวกับการออกหมายเรียก เป็นเรื่องที่ไม่เกี่ยวข้องกัน
โดยหลังจากที่เมื่อวานนี้ ตัวเองได้เข้าให้การกับพนักงานสอบสวน บก.ปปป. มีความคืบหน้าว่า ในวันพุธ หรือ พฤหัสบดีนี้จะมีการนัดพยาน เข้าไปสอบปากคําเพิ่มเติมซึ่งขณะนี้อยู่ระหว่างประสาน น.ส.พิมพ์วิไล เครือข่ายเว็บการพนันออนไลน์ และสายลับ




อ่านข่าว : ""ทนายตั้ม"" แจ้งความบิ๊ก ตร.ฟอกเงิน 1 เม.ย.พบเส้นเงินโยงเว็บพนัน 38 เส้น
ส่วนเส้นเงินที่ให้ ปปป.นั้นได้เข้าให้ข้อมูลไปแล้ว ส่วนวันที่ 3 เม.ย.นี้ จะประสานนําพยานเข้าให้ปากคําและพยานสายลับ และจากนั้นจะไปที่ศาลขอดูคําฟ้องว่ามีอะไรที่เป็นเท็จหรือไม่
ทนายตั้ม กล่าวอีกว่า ขณะนี้ไม่กังวลการที่ส่งหมายนัดนักข่าวเพราะมีพยานหลักฐานโพสต์จากวัด และยืนยันว่า ผบ.ตร.มีอํานาจในการสั่งการควบคุมบัญชีม้า และถ้าไม่มีหลักฐานก็คงไม่กล้าเพราะมีโอกาสถูกฟ้องกลับสูง




ทนายตั้มกล่าวว่า ตนมั่นใจในพยานหลักฐาน เช่น การโพสต์จากวัด ซึ่งจะสามารถยืนยันได้ว่าผู้บัญชาการตํารวจแห่งชาติ มีอํานาจในการควบคุมและสั่งการบัญชีม้าซึ่งรับส่วยมา เพราะหากไม่มั่นใจคงไม่กล้ามาแจ้งความเนื่องจากมีความเสี่ยงที่จะถูกดําเนินคดีกลับสูง
ถ้าเป็นที่อื่นระดับ ผบ.ตร.เรื่องทุจริตเป็นเรื่องใหญ่ในไทย การฟอกเงินป่านนี้คงมีการตั้งกรรมการสอบสวนแล้ว และฝ่ายค้านเองมองว่าเรื่องส่วยเป็นเรื่องใหญ่ ระดับผู้นําฝ่ายค้านให้ความสนใจการทุจริตคอร์รัปชัน ส่วนที่เลือกมาแจ้งความที่สน.เตาปูน เพราะมีการแจ้งความเว็บพนันไว้แล้ว ซึ่งอยากส่งเรื่องนี้ถึง ป.ป.ช.แต่กลัวว่าจะล่าช้า
การที่เขาฟ้องไม่ถึง 24 ชั่วโมง และถอนไปแล้ว และยังยืนยันว่ามั่นใจในหลักฐาน ไม่เช่นนั้นคงไม่แจ้งความจับ ผบ.ตร.หรอก
ทนายตั้ม ระบุว่า พยายามจะยื่นตรวจสอบในทุกหน่วยงาน ให้เยอะที่สุดเท่าที่จะยื่นได้ ตอนนี้รัฐบาลไม่สนใจใยดี วันที่ 3 เม.ย.นี้จะไปยื่นกับกรรมาธิการตํารวจของสภาฯ
ถึงแม้จะเป็น ผบ.ตร.แต่ต้องอยู่ภายใต้กฎหมายเดียวัน และ ผบ.ตร.ไม่ได้มีอํานาจเหนือกว่าประชาชนที่ไปใช้บัญชีม้า
อ่านข่าวอื่น ๆ :
""ทนายตั้ม"" ยื่นหลักฐานสอบบิ๊ก ตร.โยงเว็บพนัน ""บิ๊กเต่า"" ยันไม่ละเว้นหากผิด
""ทนายตั้ม"" อ้างขบวนการส่วยตํารวจโยง ""บิ๊กต่อ"" - เปิด 18 ธุรกิจเก็บค่าตั๋ว",https://www.thaipbs.or.th/news/content/338620
