title,article,url
DSI ส่งคำร้องคดีฟอกเงินเครือข่ายเว็บพนัน BNK Master ให้ ป.ป.ช.,"เมื่อวันที่ 30 มี.ค.2567 กรมสอบสวนคดีพิเศษ (DSI) เผยแพร่เอกสารระบุว่า เมื่อวันที่ 19 ก.พ.2567 มีผู้ร้องมายื่นเรื่องต่อกรมสอบสวนคดีพิเศษ ขอให้พิจารณาโอนคดีอาญาของ สน.เตาปูน คดีอาญาที่ 391/2567 ฐานฟอกเงิน สมคมกันฟอกเงิน กรณีเครือข่ายเว็บพนันออนไลน์ของเครือข่าย น.ส.พิมพ์พิไล หรือ เจ้พิมพ์ มาดําเนินการสืบสวนและสอบสวนตาม พ.ร.บ.การสอบสวนคดีพิเศษ พ.ศ.2547
เนื่องจากเห็นว่า มีรายละเอียดลักษณะของการกระทําความผิดเป็นไปตามประกาศคณะกรรมการ คดีพิเศษ (ฉบับที่ 8) พ.ศ.2565 เรื่อง กําหนดรายละเอียดของลักษณะของการกระทําความผิดที่เป็นคดีพิเศษ ตามมาตรา 21 วรรคหนึ่ง (1) แห่ง พ.ร.บ.การสอบสวนคดีพิเศษ พ.ศ.2547 ข้อ 4 ประกอบบัญชีท้ายประกาศฯ ข้อ 7 ซึ่งกําหนดว่า คดีความผิดที่มีบทกําหนดโทษตามมาตรา 60 และมาตรา 61 แห่ง พ.ร.บ.ป้องกันและปราบปรามการฟอกเงิน พ.ศ.2542 และที่แก้ไขเพิ่มเติม ที่มีความผิดมูลฐานเป็นคดีพิเศษซึ่งอยู่ในอํานาจหน้าที่ของพนักงานสอบสวนคดีพิเศษ หรือคดีความผิดมูลฐานที่เป็นคดีอาญาอื่นที่มีมูลน่าเชื่อว่ามีทรัพย์สิน ที่เกี่ยวกับการกระทําความผิดที่มีมูลค่าตั้งแต่ 300 ล้านบาทขึ้นไป
กรมสอบสวนคดีพิเศษได้รับเรื่องไว้สืบสวน เป็นสํานวนสืบสวนที่ 37/2567 เพื่อพิจารณาว่า เข้าข่ายที่จะมีคําสั่งไว้ทําการสอบสวนเป็นคดีพิเศษได้หรือไม่ โดยสํานวนอยู่ในความรับผิดชอบของกองคดีฟอกเงินทางอาญา
จากการสืบสวนมีการแสวงหาข้อเท็จจริงจากผู้ร้อง รวมทั้งการมีหนังสือสอบถามไปยังพนักงานสอบสวน คดีอาญาที่ 391/2566 ของ สน.เตาปูน ปรากฏข้อโต้แย้งเกี่ยวกับความเชื่อมโยงคดีอาญาดังกล่าว กับคดีอาญากรณีเว็บพนันออนไลน์มินนี่ ที่พนักงานสอบสวนสํานักงานตํารวจแห่งชาติได้ส่งเรื่องไปยังคณะกรรมการ ป.ป.ช. ก่อนหน้านี้ และเนื่องจากพระราชบัญญัติประกอบรัฐธรรมนูญว่าด้วยการป้องกันและปราบปรามการทุจริต พ.ศ.2561 มาตรา 28 (2) ได้กําหนดหน้าที่และอํานาจในการไต่สวนของคณะกรรมการ ป.ป.ช. เกี่ยวกับเจ้าหน้าที่ของรัฐกระทําผิดฐานทุจริตต่อหน้าที่ หรือกระทําความผิดต่อตําแหน่งหน้าที่ราชการ หรือความผิดต่อตําแหน่งหน้าที่ในการยุติธรรม และมาตรา 30 วรรคสอง กําหนดให้คณะกรรมการ ป.ป.ช.มีอํานาจไต่สวนในคดีที่มีการกระทําอันเป็นกรรมเดียวผิดต่อกฎหมายหลายบท และคดีที่มีความเกี่ยวข้องกันและความผิดเรื่องใดเรื่องหนึ่งที่จะต้องดําเนินการในคราวเดียวกันด้วย
กรณีดังกล่าว กรมสอบสวนคดีพิเศษเคยมีหนังสือหารือไปยังคณะกรรมการ ป.ป.ช. เกี่ยวกับแนวปฏิบัติตามมาตรา 30 วรรคสองแล้ว โดยสํานักงาน ป.ป.ช.ได้มีหนังสือที่ ปช 0026/0089 ลงวันที่ 22 ต.ค.2562 แจ้งว่าคณะกรรมการ ป.ป.ช. มีมติว่า คดีลักษณะใดเป็นคดีที่มีการกระทําความผิดเกี่ยวข้องกัน และความผิดเรื่องใดเรื่องหนึ่งที่จะต้องดําเนินการในคราวเดียวกันนั้น คณะกรรมการ ป.ป.ช.จะพิจารณาวินิจฉัยตามข้อเท็จจริงที่เกิดขึ้นเป็นรายกรณีไป ซึ่งกรณีดังกล่าวเป็นประเด็นสําคัญเกี่ยวกับอํานาจการสืบสวนและสอบสวนของกรมสอบสวนคดีพิเศษ
ดังนั้น เมื่อกรมสอบสวนคดีพิเศษไม่มีข้อเท็จจริงในคดีอาญาหลักที่มีการกล่าวอ้างที่จะเป็นข้อมูลประกอบการวินิจฉัย และเมื่อพิจารณาประกอบหนังสือสํานักงาน ป.ป.ช.ข้างต้น คณะพนักงานสืบสวนจึงมีมติเสนออธิบดีกรมสอบสวนคดีพิเศษ ให้ส่งเรื่องไปยังคณะกรรมการ ป.ป.ช.เพื่อพิจารณาพระราชบัญญัติประกอบรัฐธรรมนูญว่าด้วยการป้องกันและปราบปรามการทุจริต พ.ศ. 2561 มาตรา 30 วรรคสอง
แต่หากภายหลังคณะกรรมการ ป.ป.ช.พิจารณาแล้ว เห็นว่ามิใช่กรณีที่อยู่ในหน้าที่และอํานาจของคณะกรรมการ ป.ป.ช. กรมสอบสวนคดีพิเศษจะพิจารณาดําเนินการตาม พ.ร.บ.การสอบสวนคดีพิเศษ พ.ศ.2547 และที่แก้ไขเพิ่มเติม
อ่านข่าวอื่นๆ
""ทนายตั้ม"" ให้ปากคํา ปปป.ปมส่วย เดินหน้าเอาผิดบิ๊ก ตร.
""บิ๊กต่อ"" ถอนฟ้อง ""ทนายตั้ม"" ย้ําไม่โยงเว็บพนันพร้อมให้สอบฟอกเงิน
""อนุทิน"" หนุน ""เอ็นเตอร์เทนเมนต์ คอมเพล็กซ์"" ควบคู่บังคับใช้ กม.",https://www.thaipbs.or.th/news/content/338603
AT&T ทำข้อมูลลูกค้ารั่วสู่เว็บไซต์มืดกว่า 73 ล้านบัญชีผู้ใช้,"เมื่อวันที่ 30 มี.ค.2567 สํานักข่าวต่างประเทศรายงานว่า AT&T บริษัทด้านโทรคมนาคมของสหรัฐฯ ผู้ให้บริการโทรศัพท์มือถือที่ใหญ่เป็นอันดับ 2 และโทรศัพท์คู่สายใหญ่เป็นอันดับ 1 ในสหรัฐฯ ได้ออกแถลงการณ์ว่า
ขณะนี้ บริษัทพบว่าบัญชีผู้ใช้งานของ AT&T จํานวนหนึ่งถูกคุกคาม ขณะนี้ทางบริษัทกําลังติดต่อลูกค้าที่ได้รับผลกระทบ คาดว่าทั้งหมด 73 ล้านบัญชี ทางบริษัทพบว่า ข้อมูลที่ถูกคุกคามนั้น มีทั้งของผู้ใช้งานในปัจจุบัน (7.6 ล้านคน) และลูกค้าเก่า (65.4 ล้านคน) ทีมงานบริษัทกําลังทํางานร่วมกับผู้เชี่ยวชาญด้านความปลอดภัยทางไซเบอร์ เพื่อวิเคราะห์สถานการณ์ และเท่าที่รู้ข้อมูลที่ถูกคุกคามอาจมาจากปี 2019 หรือก่อนหน้านั้น แต่ไม่มีข้อมูลทางการเงินและประวัติการโทรของผู้ใช้บริการหลุดออกไป
BBC รายงานว่า ทาง AT&T ยังไม่ได้ข้อมูลว่าผู้ก่อเหตุเป็นใคร แต่นําผู้เชี่ยวชาญด้านความปลอดภัยทางไซเบอร์เข้ามาตรวจสอบ และได้ติดต่อไปยังผู้ใช้บริการให้รีเซ็ตรหัสผ่านของตัวเอง ข้อมูลที่เชื่อว่าอาจถูกขโมยออกสู่ตลาดมืดนั้น เป็นข้อมูลตั้งแต่ปี 2019 โดยข้อมูลที่รั่วไหลออกไปมีทั้ง ชื่อ-นามสกุล ที่อยู่ อีเมล วันเกิด แต่ไม่ปรากฏว่าข้อมูลทางการเงินหลุดออกไปหรือไม่  
เครือข่าย 5G ของ AT&T นั้นครอบคลุมผู้คนประมาณ 290 ล้านคนทั่วสหรัฐฯ และบริษัทเป็นหนึ่งในผู้ให้บริการโทรศัพท์มือถือและอินเทอร์เน็ตรายใหญ่ที่สุดของประเทศ
ในเดือน ก.พ.ที่ผ่านมา เกิดเหตุไฟฟ้าขัดข้องครั้งใหญ่ทําให้ผู้คนไม่สามารถใช้โทรศัพท์ได้เป็นเวลาประมาณเกือบ 12 ชั่วโมง ส่งผลกระทบต่อผู้ใช้โทรศัพท์หลายหมื่นรายทําให้บริษัทต้องเสนอเครดิต 5 ดอลลาร์สหรัฐ สําหรับผู้ที่ได้รับผลกระทบ อัยการในนิวยอร์กได้ทําการสอบสวนเหตุการณ์ดังกล่าว
อ่าน : AT&T สัญญาณล่มนาน 11 ชม. สหรัฐฯ ชี้ยังไม่พบเหตุโยงโจมตีไซเบอร์",https://www.thaipbs.or.th/news/content/338604
เปิดฉาก! งานฟุตบอลสานสัมพันธ์จุฬาฯ-ธรรมศาสตร์ 2024,"วันนี้ (31 มี.ค.2567) การจัดงานฟุตบอลสานสัมพันธ์จุฬา-ธรรมศาสตร์ ในปีนี้จัดขึ้นภายใต้แนวคิด Unity to Sustainability ไฮไลต์ของการจัดงานเริ่มด้วยขบวนพาเหรดล้อการเมืองของทั้ง 2 สถาบัน ที่สนามศุภชลาศัย




จุฬาลงกรณ์มหาวิทยาลัย มาในธีม limitless possibilities ที่พร้อมจะทลายกําแพงที่ตีกรอบศักยภาพของมนุษย์ พร้อมด้วยขบวนล้อการเมืองที่สะท้อนถึงปัญหาการศึกษาไทย สิทธิของคนจน และความหลากหลายทางเพศ




ขณะที่มหาวิทยาลัยธรรมศาสตร์ มาในแนวคิด turn back time ภายใต้ธีม gatsby ผสมผสานความหรูหรา แสงสีและเสรีภาพ ผ่านความหลากหลายทุกแง่มุม พร้อมขบวนล้อการเมืองที่สะท้อนถึงปัญหาการใช้กฎหมาย การทํางานของศาล และสิทธิของประชาชนและแรงงาน
ส่วนการแปรอักษรในปีนี้มีการใช้จอ LED กว่า 400 จอ แทนการแปรอักษรรูปแบบเดิม โดยมีทั้งข้อความหยอกล้อกันของทั้ง 2 สถาบัน รวมถึงข้อความที่แสดงถึงปัญหาสภาพเศรษฐกิจ สังคม การเมืองและสิ่งแวดล้อม



 


 


 


 


 


 


 


 



อ่านข่าวอื่นๆ
สภาพอากาศวันนี้ ระวังฮีทสโตรก! หลายจังหวัดร้อนทะลุ 40 องศาฯ
""แบร์บริค"" กลไกมิจฉาชีพฟอกเงินผ่าน ""ของเล่นราคาแพง""
1 เม.ย. จับลิงหัวโจกอีกรอบ โซเชียลตั้งค่าหัว ""จ๋อหูแหว่ง-ธณเดช""",https://www.thaipbs.or.th/news/content/338605
"""กรมราง"" แจงหยุดก่อสร้าง 7 วัน สายสีชมพูส่วนต่อขยายเมืองทองฯ","วันนี้ (31 มี.ค.2567) นายพิเชฐ คุณาธรรมรักษ์ อธิบดีกรมการขนส่งทางราง (ขร.) ชี้แจงกรณีเศษคอนกรีตหล่นใส่รถยนต์ ขณะเทคอนกรีตเพื่อก่อสร้างพื้นชั้นจําหน่ายบัตรโดยสาร ของสถานีอิมแพค เมืองทองธานี ในโครงการก่อสร้างรถไฟฟ้าสายสีชมพู ส่วนต่อขยาย (เมืองทองธานี-ทะเลสาบเมืองทองธานี) ส่งผลให้รถยนต์ได้รับความเสียหาย เมื่อวันที่ 30 มี.ค.ที่ผ่านมา และต่อมาได้มีสื่อเผยแพร่ข้อความ ""หยุดพักงาน 7 วัน สายสีชมพู"" นั้น
อธิบดีกรมการขนส่งทางราง กล่าวว่า กรณีดังกล่าว ขร.ได้ประสานการรถไฟฟ้าขนส่งมวลชนแห่งประะเทศไทย (รฟม.) พิจารณาสั่งการให้ผู้รับงานก่อสร้างรถไฟฟ้ามหานคร สายสีชมพู ส่วนต่อขยาย (เมืองทองธานี-ทะเลสาบเมืองทองธานี) หยุดงานก่อสร้างในพื้นที่ดังกล่าวเป็นเวลา 7 วัน และให้บริษัทที่ปรึกษาโครงการฯ ตรวจสอบขั้นตอนการทํางาน และผู้รับผิดชอบในพื้นที่ รวมทั้งแนวทางการป้องกันการเกิดเหตุ การแก้ไข ก่อนที่จะเริ่มก่อสร้างต่อไป
แต่ไม่ได้เป็นการสั่งหยุดการให้บริการเดินรถไฟฟ้ามหานคร สายสีชมพู แต่อย่างใด โดยบริษัท นอร์เทิร์น บางกอก โมโนเรล จํากัด (NBM) ผู้รับสัมปทาน ยังคงให้บริการเดินรถไฟฟ้ามหานคร สายสีชมพู ช่วงสถานีศูนย์ราชการนนทบุรี ถึงสถานีมีนบุรี ครบทั้ง 30 สถานีตามปกติ
อ่านข่าวอื่นๆ
""สนธิญา"" เล็งยื่นศาลฯยุติบริการ รฟฟ.สายสีชมพู-เหลือง หากเกิดเหตุไม่ปลอดภัยขึ้นอีก
""ทนายตั้ม"" ให้ปากคํา ปปป.ปมส่วย เดินหน้าเอาผิดบิ๊ก ตร.
""แบร์บริค"" กลไกมิจฉาชีพฟอกเงินผ่าน ""ของเล่นราคาแพง""",https://www.thaipbs.or.th/news/content/338606
ธปท.สั่งเลื่อนเก็บค่ารูดบัตร 1% ชอป ตปท.ออกไป 3 เดือน,"ธนาคารแห่งประเทศไทย (ธปท.) หารือกับชมรมบัตรเครดิต กรณีที่ผู้ให้บริการบัตรเครดิต วีซา มาสเตอร์การ์ด เตรียมเรียกเก็บค่าธรรมเนียมเพิ่มเติมร้อยละ 1 เมื่อชําระด้วยบัตรเครดิตที่ร้านค้าในต่างประเทศ ทั้งหน้าร้านและออนไลน์ ซึ่งจะมีผลในวันที่ 1 พ.ค.2567
อ่านข่าว : เริ่ม 1 พ.ค. กดเงินสด-รูดบัตรร้านจดทะเบียน ตปท. เสียค่าธรรมเนียม 1%
ชญาวดี ชัยอนันต์ ผู้ช่วยผู้ว่าการ สายองค์กรสัมพันธ์ และโฆษก ธปท. ระบุว่า ได้ขอให้ยกเว้นการเก็บค่าธรรมเนียมดังกล่าวออกไปก่อนเป็นระยะเวลา 3 เดือน หรือจนถึงเดือน ก.ค. เพราะยังเห็นว่ามีประเด็นเรื่องการสื่อสารในการเรียกเก็บค่าธรรมเนียมที่ไม่ชัดเจน ทําให้ผู้บริโภคอาจจะเข้าใจผิด
และยังมีหลายกรณีที่เกี่ยวข้อง เช่น การนําบัตรไปใช้จ่ายในต่างประเทศที่มีทางเลือก แต่มีกรณีที่จ่ายเงินผ่านออนไลน์ในร้านค้าที่เป็นแพลตฟอร์มต่างประเทศ ซึ่งลูกค้ายังไม่มีทางเลือก ซึ่งระหว่างนี้ ธปท.จะหารือและทบทวนกับผู้ให้บริการบัตรเครดิตอีกครั้ง ก่อนจะพิจารณาให้จัดเก็บในระยะข้างหน้า
อ่านข่าวอื่นๆ
""แบร์บริค"" กลไกมิจฉาชีพฟอกเงินผ่าน ""ของเล่นราคาแพง""
AT&T ทําข้อมูลลูกค้ารั่วสู่เว็บไซต์มืดกว่า 73 ล้านบัญชีผู้ใช้
สธ.เตือน ""ยาทรามาดอล"" ผลข้างเคียงสูง ใช้ไม่ถูกทางเสี่ยงเสียชีวิต",https://www.thaipbs.or.th/news/content/338607
